company_slug,company_name,website,yc_directory_url,careers_page,job_source_type,job_source_url,job_source_job_count,job_source_last_verified_at,job_source_notes,board_type,board_url,board_token,board_api_url,board_confirmation_status,resolved_from_url,jd_capture_status,jd_format,jd_extraction_method,jd_extraction_locator,jd_last_verified_at,jd_notes
10x-science,10x Science,https://10xscience.com,https://www.ycombinator.com/companies/10x-science,https://10xscience.com/open-positions/,yc_jobs_page,https://www.ycombinator.com/companies/10x-science/jobs,1,2026-06-08T02:35:48Z,"Company page does not expose a usable public job listing. YC jobs page shows the live role and links to a detailed YC JD page.",,,,,,https://www.ycombinator.com/companies/10x-science/jobs,full_jd_verified,html_detail_page,yc_jobs_list_to_detail_pages,/companies/10x-science/jobs/<job_slug>,2026-06-08T02:35:48Z,"YC detail page exposes About the role content and other JD fields."
a0-dev,a0.dev,https://a0.dev,https://www.ycombinator.com/companies/a0-dev,https://a0.dev/careers,yc_jobs_page,https://www.ycombinator.com/companies/a0-dev/jobs,2,2026-06-08T02:35:48Z,"Company careers page is stale and currently shows one old role. YC jobs page currently shows two live roles and is the better source for daily tracking.",,,,,,https://www.ycombinator.com/companies/a0-dev/jobs,full_jd_verified,html_detail_page,yc_jobs_list_to_detail_pages,/companies/a0-dev/jobs/<job_slug>,2026-06-08T02:35:48Z,"Use the YC company jobs page as the listing source and follow its job-detail links for the full JD."
adam,Adam,https://adam.new/,https://www.ycombinator.com/companies/adam,https://adam.new/careers,yc_jobs_page,https://www.ycombinator.com/companies/adam/jobs,3,2026-06-08T02:35:48Z,"Company page lists the roles but the YC jobs page gives a more standardized surface and stable job detail pages for the full JD.",,,,,,https://www.ycombinator.com/companies/adam/jobs,full_jd_verified,html_detail_page,yc_jobs_list_to_detail_pages,/companies/adam/jobs/<job_slug>,2026-06-08T02:35:48Z,"YC job detail pages expose About the role content. The company page can remain a secondary verification surface."
aden,Aden,https://adenhq.com/,https://www.ycombinator.com/companies/aden,https://adenhq.com/careers,company_careers_page,https://adenhq.com/careers,7,2026-06-08T02:35:48Z,"Company careers page directly lists the roles and exposes detailed sections such as Responsibilities and Qualifications.",,,,,,https://adenhq.com/careers,full_jd_verified,html_same_page,same_page_html_sections,role sections under /careers,2026-06-08T02:35:48Z,"The first-party careers page already contains JD content so it is the preferred source over the YC mirror."
agape,Agapé,https://www.getdailyagape.com,https://www.ycombinator.com/companies/agape,https://www.getdailyagape.com,yc_jobs_page,https://www.ycombinator.com/companies/agape/jobs,1,2026-06-08T02:35:48Z,"Company site does not expose public job listings. YC jobs page shows the live role and links to a detailed YC JD page.",notion,https://www.getdailyagape.com/,,,detected_structured_board,https://www.ycombinator.com/companies/agape/jobs,full_jd_verified,html_detail_page,yc_jobs_list_to_detail_pages,/companies/agape/jobs/<job_slug>,2026-06-08T02:35:48Z,"YC detail page exposes About the role content. The detected Notion surface is not the active public jobs source."
agave,Agave,https://www.useagave.com,https://www.ycombinator.com/companies/agave,https://www.useagave.com/careers,yc_jobs_page,https://www.ycombinator.com/companies/agave/jobs,9,2026-06-08T02:35:48Z,"Company careers page is a hiring landing page but the role-level Apply links go to YC job detail pages. Use YC as the direct JD source.",,,,,,https://www.ycombinator.com/companies/agave/jobs,full_jd_verified,html_detail_page,yc_jobs_list_to_detail_pages,/companies/agave/jobs/<job_slug>,2026-06-08T02:35:48Z,"YC detail pages expose About the role and Requirements sections."
agilemd,AgileMD,https://agilemd.com,https://www.ycombinator.com/companies/agilemd,https://app.dover.com/jobs/agilemd,structured_board,https://app.dover.com/jobs/agilemd,,2026-06-08T02:35:48Z,"Dover board is the public careers surface and is more reliable than the YC mirror.",dover,https://app.dover.com/jobs/agilemd,,,detected_structured_board,https://app.dover.com/jobs/agilemd,unconfirmed,unknown,browser_required_js_board,https://app.dover.com/jobs/agilemd,2026-06-08T02:35:48Z,"Static HTML is only the JS shell. We still need endpoint discovery or a browser-rendered extraction path for the JD."
airgoods,Airgoods,https://airgoods.com/,https://www.ycombinator.com/companies/airgoods,https://airgoods.com/,yc_jobs_page,https://www.ycombinator.com/companies/airgoods/jobs,5,2026-06-08T02:35:48Z,"Company page is a JS app without usable public listings in the static response. YC jobs page shows the live roles and links to detailed YC JD pages.",,,,,,https://www.ycombinator.com/companies/airgoods/jobs,full_jd_verified,html_detail_page,yc_jobs_list_to_detail_pages,/companies/airgoods/jobs/<job_slug>,2026-06-08T02:35:48Z,"YC detail pages expose About the role content."
aivideo-com,AIVideo.com,https://aivideo.com,https://www.ycombinator.com/companies/aivideo-com,https://aivideo.com,yc_jobs_page,https://www.ycombinator.com/companies/aivideo-com/jobs,1,2026-06-08T02:35:48Z,"Company page is behind a sign-in flow. YC jobs page shows the live role and links to a detailed YC JD page.",,,,,,https://www.ycombinator.com/companies/aivideo-com/jobs,full_jd_verified,html_detail_page,yc_jobs_list_to_detail_pages,/companies/aivideo-com/jobs/<job_slug>,2026-06-08T02:35:48Z,"YC detail page exposes About the role content."
algolia,Algolia,http://www.algolia.com,https://www.ycombinator.com/companies/algolia,https://www.algolia.com/careers,company_careers_page,https://www.algolia.com/careers,40,2026-06-08T02:35:48Z,"Use the first-party careers page. It embeds a public Algolia search configuration that returns the live roles and full JD HTML.",,,,,,https://www.algolia.com/careers,full_jd_verified,html_search_api,embedded_algolia_search_api,"appId=1QDAWL72TQ;index=PROD_algolia.com-career-page;queryKey=e4a02579f71e679d4bfee18204888df9",2026-06-08T02:35:48Z,"The careers page embeds a public search config. Querying the index returns the job title metadata and JD HTML in the content field."
andy-ai,Andy AI,https://with-andy.com,https://www.ycombinator.com/companies/andy-ai,https://with-andy.com/careers,yc_jobs_page,https://www.ycombinator.com/companies/andy-ai/jobs,2,2026-06-08T03:02:00Z,"Company careers page lists role titles but links out to YC for the actual job pages. Use YC so the job list and JD come from one surface.",,,,,,https://with-andy.com/careers,full_jd_verified,html_detail_page,yc_jobs_list_to_detail_pages,/companies/andy-ai/jobs/<job_slug>,2026-06-08T03:02:00Z,"YC detail pages expose About the role content."
anglera,Anglera,https://www.anglera.com/,https://www.ycombinator.com/companies/anglera,https://www.anglera.com/jobs,yc_jobs_page,https://www.ycombinator.com/companies/anglera/jobs,2,2026-06-08T03:02:00Z,"Company jobs page is a marketing surface with a View Open Roles link to YC. Use YC as the direct JD source.",,,,,,https://www.anglera.com/jobs,full_jd_verified,html_detail_page,yc_jobs_list_to_detail_pages,/companies/anglera/jobs/<job_slug>,2026-06-08T03:02:00Z,"YC detail pages expose About the role content."
apero-health,Apero Health,https://www.aperohealth.com,https://www.ycombinator.com/companies/apero-health,https://www.aperohealth.com/,yc_jobs_page,https://www.ycombinator.com/companies/apero-health/jobs,3,2026-06-08T03:02:00Z,"The company site links to YC jobs but does not expose a dedicated careers page with JD content. Use YC for the live roles and JD detail pages.",,,,,,https://www.aperohealth.com/,full_jd_verified,html_detail_page,yc_jobs_list_to_detail_pages,/companies/apero-health/jobs/<job_slug>,2026-06-08T03:02:00Z,"YC detail pages expose About the role content."
apollo-io,Apollo.io,https://www.apollo.io/,https://www.ycombinator.com/companies/apollo-io,https://www.apollo.io/careers,yc_jobs_page,https://www.ycombinator.com/companies/apollo-io/jobs,3,2026-06-08T03:02:00Z,"Company careers page is a hiring brand page but does not expose JD-rich role content in the static HTML. YC gives live role listings and detail pages.",,,,,,https://www.apollo.io/careers,full_jd_verified,html_detail_page,yc_jobs_list_to_detail_pages,/companies/apollo-io/jobs/<job_slug>,2026-06-08T03:02:00Z,"YC detail pages expose About the role content."
aptdeco,AptDeco,https://www.aptdeco.com/,https://www.ycombinator.com/companies/aptdeco,https://www.aptdeco.com/careers,yc_jobs_page,https://www.ycombinator.com/companies/aptdeco/jobs,3,2026-06-08T03:02:00Z,"Company careers page links to Gem apply pages but the static HTML does not expose the JD. YC is the easier deterministic JD source.",,,,,,https://www.aptdeco.com/careers,full_jd_verified,html_detail_page,yc_jobs_list_to_detail_pages,/companies/aptdeco/jobs/<job_slug>,2026-06-08T03:02:00Z,"YC detail pages expose About the role and Qualifications sections."
arc-prize-foundation,ARC Prize Foundation,https://arcprize.org/,https://www.ycombinator.com/companies/arc-prize-foundation,https://arcprize.org/jobs,company_careers_page,https://arcprize.org/jobs,2,2026-06-08T03:02:00Z,"The company jobs page itself contains full role descriptions with What You'll Do and What We're Looking For sections.",,,,,,https://arcprize.org/jobs,full_jd_verified,html_same_page,same_page_html_sections,open roles section under /jobs,2026-06-08T03:02:00Z,"The first-party jobs page exposes role-level JD text on the same page."
arlo-industries,Arlo Industries,https://arlo1.com/,https://www.ycombinator.com/companies/arlo-industries,https://arlo1.com/careers,yc_jobs_page,https://www.ycombinator.com/companies/arlo-industries/jobs,2,2026-06-08T03:02:00Z,"The company careers page is effectively empty in the static response. YC provides the live roles and JD detail pages.",,,,,,https://arlo1.com/careers,full_jd_verified,html_detail_page,yc_jobs_list_to_detail_pages,/companies/arlo-industries/jobs/<job_slug>,2026-06-08T03:02:00Z,"YC detail pages expose About the role content."
arnata,arnata,https://arnata.com,https://www.ycombinator.com/companies/arnata,https://arnata.com,yc_jobs_page,https://www.ycombinator.com/companies/arnata/jobs,9,2026-06-08T03:02:00Z,"The company site points careers traffic to YC. Use the YC jobs page because it carries both the listing set and the JD detail pages.",,,,,,https://arnata.com,full_jd_verified,html_detail_page,yc_jobs_list_to_detail_pages,/companies/arnata/jobs/<job_slug>,2026-06-08T03:02:00Z,"YC detail pages expose About the role content."
arpari,Arpari,https://www.arpari.com,https://www.ycombinator.com/companies/arpari,https://www.arpari.com,yc_jobs_page,https://www.ycombinator.com/companies/arpari/jobs,3,2026-06-08T03:02:00Z,"The company site points careers traffic to YC. Use the YC jobs page because it provides the live roles and full JD detail pages.",,,,,,https://www.arpari.com,full_jd_verified,html_detail_page,yc_jobs_list_to_detail_pages,/companies/arpari/jobs/<job_slug>,2026-06-08T03:02:00Z,"YC detail pages expose About the role and Responsibilities sections."
artifact-2,Artifact,https://www.artifact.engineer/,https://www.ycombinator.com/companies/artifact-2,https://www.artifact.engineer/careers,company_careers_page,https://www.artifact.engineer/careers,3,2026-06-08T03:02:00Z,"The company careers page contains full role descriptions on the same page and does not require a second surface for JD extraction.",,,,,,https://www.artifact.engineer/careers,full_jd_verified,html_same_page,same_page_html_sections,open roles section under /careers,2026-06-08T03:02:00Z,"The first-party careers page exposes role-level JD text on the same page."
artisan,Artisan,https://www.artisan.co/?utm_source=ycombinator,https://www.ycombinator.com/companies/artisan,https://www.artisan.co/careers,yc_jobs_page,https://www.ycombinator.com/companies/artisan/jobs,11,2026-06-09T01:00:31Z,"The company careers page is mostly a hiring brand page and does not expose a deterministic static role listing. YC currently exposes the live roles and JD detail pages.",,,,,,https://www.artisan.co/careers,full_jd_verified,html_detail_page,yc_jobs_list_to_detail_pages,/companies/artisan/jobs/<job_slug>,2026-06-09T01:00:31Z,"YC detail pages expose the role overview and JD sections."
assembly-com,Assembly,https://www.assembly.com,https://www.ycombinator.com/companies/assembly-com,https://assembly.com/jobs,company_careers_page,https://assembly.com/jobs,3,2026-06-09T01:00:31Z,"The first-party jobs page lists the live roles and each role links to a same-domain detail page with usable JD content.",,,,,,https://assembly.com/jobs,full_jd_verified,html_detail_page,company_jobs_list_to_detail_pages,/jobs/<job_slug>,2026-06-09T01:00:31Z,"Assembly job detail pages expose the role description and hiring context on the company domain."
asteroid,Asteroid,https://asteroid.ai,https://www.ycombinator.com/companies/asteroid,https://asteroid.ai/careers/,company_careers_page,https://asteroid.ai/careers/,3,2026-06-09T01:00:31Z,"The first-party careers page lists the open roles and links to same-domain role pages with full JD content.",,,,,,https://asteroid.ai/careers/,full_jd_verified,html_detail_page,company_jobs_list_to_detail_pages,/careers/<job_slug>,2026-06-09T01:00:31Z,"Asteroid role detail pages expose the job description on the company domain."
astroforge,AstroForge,https://www.astroforge.io/,https://www.ycombinator.com/companies/astroforge,https://www.astroforge.com/careers,yc_jobs_page,https://www.ycombinator.com/companies/astroforge/jobs,2,2026-06-09T01:00:31Z,"The company careers page is a hiring landing page in static HTML and does not expose deterministic role listings or JD text. YC provides the live roles and JD detail pages.",,,,,,https://www.astroforge.com/careers,full_jd_verified,html_detail_page,yc_jobs_list_to_detail_pages,/companies/astroforge/jobs/<job_slug>,2026-06-09T01:00:31Z,"YC detail pages expose the role content for the live openings."
atomic-industries,Atomic Industries,http://atomic.industries,https://www.ycombinator.com/companies/atomic-industries,https://atomic.industries/open-positions/,yc_jobs_page,https://www.ycombinator.com/companies/atomic-industries/jobs,9,2026-06-09T01:00:31Z,"The company site does not expose a usable static job list or JD content. YC currently provides the live role set and detailed JD pages.",,,,,,https://atomic.industries/open-positions/,full_jd_verified,html_detail_page,yc_jobs_list_to_detail_pages,/companies/atomic-industries/jobs/<job_slug>,2026-06-09T01:00:31Z,"YC detail pages expose the role overview and JD sections."
autosana,Autosana,https://autosana.ai,https://www.ycombinator.com/companies/autosana,https://autosana.ai/login?next=%2Fopen-positions%2F,yc_jobs_page,https://www.ycombinator.com/companies/autosana/jobs,1,2026-06-09T01:00:31Z,"The company careers URL currently resolves to a login wall. YC provides the public role listing and JD detail page.",,,,,,https://autosana.ai/login?next=%2Fopen-positions%2F,full_jd_verified,html_detail_page,yc_jobs_list_to_detail_pages,/companies/autosana/jobs/<job_slug>,2026-06-09T01:00:31Z,"YC detail page exposes the role content publicly."
avent,Avent,https://www.aventindustrial.com,https://www.ycombinator.com/companies/avent,https://www.aventindustrial.com/careers,yc_jobs_page,https://www.ycombinator.com/companies/avent/jobs,3,2026-06-09T01:00:31Z,"The company careers page is an interest form and does not expose role-level JD content. YC provides the live roles and JD detail pages.",,,,,,https://www.aventindustrial.com/careers,full_jd_verified,html_detail_page,yc_jobs_list_to_detail_pages,/companies/avent/jobs/<job_slug>,2026-06-09T01:00:31Z,"YC detail pages expose the role content for the live openings."
averyiq,AveryIQ,https://averyiq.com,https://www.ycombinator.com/companies/averyiq,https://averyiq.com/careers,yc_jobs_page,https://www.ycombinator.com/companies/averyiq/jobs,2,2026-06-09T01:00:31Z,"The company careers page is a hiring brand page with a generic apply flow rather than deterministic public JD pages. YC is the cleaner source for live roles and JD detail pages.",,,,,,https://averyiq.com/careers,full_jd_verified,html_detail_page,yc_jobs_list_to_detail_pages,/companies/averyiq/jobs/<job_slug>,2026-06-09T01:00:31Z,"YC detail pages expose the role content publicly."
avoca,Avoca,https://www.avoca.ai/,https://www.ycombinator.com/companies/avoca,https://www.avoca.ai/careers#open-roles,yc_jobs_page,https://www.ycombinator.com/companies/avoca/jobs,1,2026-06-09T01:00:31Z,"The company careers page is primarily a marketing page and does not expose deterministic static role detail pages. YC provides the public role listing and JD detail page.",,,,,,https://www.avoca.ai/careers#open-roles,full_jd_verified,html_detail_page,yc_jobs_list_to_detail_pages,/companies/avoca/jobs/<job_slug>,2026-06-09T01:00:31Z,"YC detail page exposes the role content publicly."
avora,Avora,https://www.getavora.ai,https://www.ycombinator.com/companies/avora,https://careers.getavora.ai/,yc_jobs_page,https://www.ycombinator.com/companies/avora/jobs,2,2026-06-09T01:00:31Z,"The company careers page is a Notion JS shell in static HTML, so it is not a reliable deterministic JD source without browser rendering. YC provides the live roles and JD detail pages.",,,,,,https://careers.getavora.ai/,full_jd_verified,html_detail_page,yc_jobs_list_to_detail_pages,/companies/avora/jobs/<job_slug>,2026-06-09T01:00:31Z,"YC detail pages expose the role content publicly."
